,Review,
92,Как говорят театр начинается с вешалка. Так и кафе начинается с туалета. Очень чисто и красиво. Все на 5 с +. Только прохладно за счет этого постоянно просила кипяток к чаю. Я спец по чаю. Как то была разочарована. А в остальное молодцы. Обязательно придем еще,positive
93,Очень понравились интерьер и десерты,positive
94,"Классная кафешка. Супер что вместо темного бара появился BAL. Замечательный завтрак. Цены вкусные. Единственно что не понравилось: мне было прохладно, кофту я даже не снимала.На улице минус 9 и хочется тепла и горячего чаю.",positive
95,"Очень вкусный наполеон! Свежий, вкусный, настоящий! Благодарю ❤️",positive
96,"Синаббоны , вкуснО 😋 !",positive
97,"Заказала все виды круассанов, безумно вкусные,начинка, тесто, и крупные😍👍🏼 Спасибо большое ❤️",positive
98,"Очень вкусно всё, и выпечка, и блюда
 Красиво, уютно
 Но чаи невкусные, как авторские, так и обычные
 Прохладно, дует
 Обслуживание немного долгое",positive
99,"Круассаны и вся выпечка здесь действительно очень вкусные, чувствуется качество. Но обслуживание оставляет желать лучшего — очень медленно. Ещё один минус — в помещении так холодно, что чай буквально остывает за пару минут. Хотелось бы, чтобы над этим поработали",negative
100,"Посетили данное заведение, хотелось бы отметить первым делом обслуживание, которое было на высоте! Встретили приятно, проводили до столика.Очень понравились десерты и кофе. Ставлю 10/10!",positive
101,"Всегда пишу отзывы после посещения, но в этот раз так восхищена, что пишу здесь и сейчас. Крем-суп с креветками бомбический, салат с замеченным лососем тоже наивкуснейший, боюсь пробовать десерт, вдруг он будет слишком вкусный и я не захочу уходить отсюда 🙈. Подача блюд великолепная 😍",positive
102,"Уютно! Вкусно! Но девушкам лучше бы волосы собрать и надеть фартуки. А то куда не глянь - везде волосы! Это все таки пекарня, а не парикмахерская",negative
103,"Всегда свежая выпечка,вежливый персонал!очень уютно и красиво.Процветания вам!",positive
104,"Попросила поменять чай с яблоком с корицей на обычный черной ,так как эту бурду невозможно пить ,как юпи с таким химическим вкусом
 В итоге заплатила за чай который не выпила",negative
105,"Выпечка у 10/10
 Интерьер 10/10
 но напитки оставляют желать лучшего:
 чай с яблоком и корицей - просто вода с сиропом
 халва раф - слишком жидкий, без сливок, халвы не чувствуется",negative
106,"Ең бастысы персонал өте сыпайы, өз істерін сүйіп жасайтыны көрініп тұр 👏🏻👏🏻👏🏻",positive
107,"ОЧЕЕНЬ ВКУСНО, ПЕРСОНАЛ ОТЛИЧНЫЙ😍😍😍😍😍
 Девушка у десертной словно слонышко, Динара зовут🥰",positive
108,"Өте жайлы, атмосферасы ұнады, эстетикалық орын екен. Дәрет алатын жер, намаз оқуға арналған бұрышта бар. Мәзірінінде де ерекше тағамдар. Жалпы өте қатты ұнады✨🫶🏻",positive
109,"Тортики кофейни Bal самые вкусные, нежные, воздушные!!! Рекомендую обязательно попробовать!!! Взяли наполеон и медовый, оба тортика рекомендую!",positive
110,"Видимо Вселенная меня услышала, живу рядом и на районе не было приличной кофейни, наконец-то появилась кофейня “Bal” ♥️
 Не могу жить без кофе, американо вкусный ♥️
 Потихоньку изучаю все завтраки, хочу попробовать все, по десертам у меня супруг 😋
 Очень уютное, красивое эстетичное заведение, чистейшие уборные, атмосфера уюта. Кайфую от дизайна, все очень стильно и со вкусом, за что благодарю хозяев, Вы создали что-то шедевральное 💎
 А теперь лицо заведения - официанты, девочки на кассе, хостес - Супер молодцы 👏🏽 уже с порога располагающая атмосфера, Сервис на уровне ♥️♥️♥️
 Процветания Вам, будем постоянными гостями ♥️♥️♥️",positive
111,Шикарно все,positive
112,"Өте қатты ұнады!
 Официанттары жылы жүзді!",positive
113,"Люблю это место за приветливый персонал, каждый день заходим за булочками, выпечкой. Кухня тоже вкусная, оформление кофейни вообще отдельный восторг😍",positive
114,"Очень уютная атмосфера, стильный интерьер и потрясающее меню, а цены приятно удивляют. 🥰
 Особую благодарность хочется выразить официанту Дарын за великолепное обслуживание и внимание к деталям.
 Благодаря вам мы почувствовали себя как дома! Команда этого заведения действительно заслуживает похвалы за свою работу и душевное отношение. 💕
 

 Теперь BAL — одно из наших любимых местечек, которое навсегда останется в сердце! 🫶",positive
115,"Очень уютное и эстетичное место🥰😘Кухня на высшем уровне🔝Десерты очень понравились🤤Нас обслуживал парень по имени Дарын,спасибо ему огромное,очень вежливый и приятный персонал🙌🏻",positive
116,Самые вкусные круасаны! Всегда свежие и с различными начинками на любой вкус! Быстро можно заказать или приехать покушать в самом кафе!,positive
117,"Бүгін бірінші рет тамақтануға келдік.Дарын мен Аяулымға рахмет өте жоғары деңгейде қызмет көрсеткендері үшін.Таңдау тамақтарға өте көп әрі дәмді.Круассан міндетті түрде барсаңыздар дәмін көріңіздер.Қаншама жерден дәмін көрсемде,ең дәмісі осы болды.Іші өте жайлы әрі әдемі.Міндетті түрде тағы да барамыз❤️❤️",positive
118,Наполеон 😋😋👍,positive
119,"Десерты всегда свежие и вкусные. Обслуживание нравится, как будто сходила к своим близким друзьям",positive
120,"Всем советую, обслуживание на высшем уровне, персонал очень приветливый. Кухня очень вкусная 👍🏻",positive
121,Вкусно и точка,positive
122,"Стильно
 Вкучно",positive
123,Вкусно и стильно) нам понравилось)),positive
124,Наполеон очень легкий и воздушный. Как будто с мороженым 😍,positive
125,"Заказывала торт сникерс,
 полученный торт был вкусный, но он не похож на сникерс (шоколадный бисквит с кремом больше напоминающим йогуртовый крем, не было карамели, обилия орешков), поэтому прежде чем заказать попросите фото в разрезе и убедитесь что это то что вы хотели",positive
126,"Лучшее заведение, все понравилось👍🏻все на высоком уровне.Очень уютно, вкусно и красиво. Все сотрудники очень вежливые, спасибо им большое🥰. Советую всем😍🤍",positive
127,Замечательное место с уютной атмосферой и очень вкусной выпечкой. Обязательно вернусь сюда снова!,positive
128,"Уютное и стильное заведение, приятный персонал. Долгое время искали в городе вкусный Наполеон и , о чудо Мы нашли именно здесь. Нежный, насыщенный вкус. 👍👍👍",positive
129,Так уютно и вкусно 😍😼,positive
130,"Очень вкусный торт. Чувствуется, что сделано с душой и не использовались дешевые продукты.
 Спасибо! Буду только у вас заказывать ✨",positive
131,"Заказывали персиковый пирог. На видео очень красивый и выглядить аппетитна. Но когда пробвали, не вкусно. Я так хотела персиковый пирог. Ожидание и реальность точно разные.",negative
132,Амбальный шоколадный круассан имба,positive
133,Приятное заведение!,positive
134,Торт наполеон просто супер,positive
135,"Хорошие место , чисто и вкусно .синнабон очень вкусный",positive
136,"Новое крутое заведение! Интерьер выполнен на высшем уровне, столы из натурального камня, красивая подача блюд. От вкуса блюд получили настоящее гастрономическое удовольствие!!! Редко встретишь в наше время такого уровня заведения с средним чеком на двоих 15000 тг.",positive
137,Интерьер и выпечка 👍,positive
138,"Очень приятное и милое заведение. Спасибо за хорошое обслуживание официантам Альбина и Дарын. Всё было вкусно, цена соответствует качеству. Советую посетить это место✨",positive
139,"Все было очень вкусно!
 Официанты Альбина и Дарын всегда отзывчивые и вежливые🥹👍",positive
140,"Вкусная еда, приятная атмосфера и очень вежливый персонал",positive
141,"Тамаша қызмет көрсету және жылы атмосфера үшін үлкен алғысымды білдіремін!
 Дарын мен Альбина ерекше кәсібиліктері мен мейірімділіктерімен бізді қуантты. Тамақ дәмді, ал қызмет көрсету жоғары деңгейде болды.
 Міндетті түрде қайта келеміз!🔥",positive
142,"Красивое и уютное место, брали Наполеон, легкий, вкусный и совершенно не жирный! Обслуживание комфортное.",positive
143,"Благодарю за самый вкусный Наполеон 🙏
 Вкус божественный , очень нежный, свежий, красивый и неповторимо вкусный 🤩🤩🤩🤩😋😋😋😋😋 Рекомендую всем!",positive
144,"Десерттері дәмді, іші эстетикаға толы
 

 UPD: 22.11 тағы да келдім. Музыкальный вкустары күшті екен: Бритни Спирс, Гвен Стефани, Леди Гага, Марина 🙌🏻",positive
145,Самые лучшие просто десерты в городе😍 Очень вежливые и внимательные официанты - с порога встречают улыбаясь. Атмосфера здесь очень уютная. Уверена приду ещё не раз.Так держать!,positive
146,"Хочу поблагодарить за замечательное обслуживание и отличный десерт! Наполеон, который я попробовала, был восхитительным, нежный, с идеальным балансом теста и крема. Это настоящий шедевр кулинарии! Особая благодарность официанту Аяу за её чуткость и внимательность — она создала атмосферу уюта и угощала нас с душой. Также хочется поблагодарить администратора Арай за её доброжелательность и профессионализм. Атмосфера в заведении действительно оставила приятное впечатление, рекомендую всем попробовать и посетить это место!",positive
147,"Добрый вечер! Наполеон очень вкусный, но!!! Брали его 3 раза, первые два раза был волшебным, я ещё администратора поблагодарила за такой вкусный торт. Пришли в 3 раз, чего стоило ожидать! Наполеон не такой как впервые два раза! Уже мокрый, не так хрустел , коржи не такие ! Очень жаль, после рекламы идёт большой наплыв клиентов, в итоге потом вкус не такой как впервый раз! Что самое обидное, я сделала замечание и к нам даже админ не подошела и не спросила, хотя ей официантка сразу же побежала и сказала! Вот что значит когда клиентов привлекли! Удачи, больше не придем !",negative
148,Спасибо большое за божественный торт Наполеон 👍…..люди вы должны это попробовать ! Я давно не кушала такой вкуснятины !!! Гости проглотили его живьем😹,positive
149,"Пожалуй это самый вкусный Наполеон, который я заказывала когда-либо!",positive
150,"Бәрі әдемі, тамақтары дәмді,келуге тұрарлық жер бірақ қызмет көрсету сапасы нашар. Бізге қызмет көрсеткен даяшы дұрыс көмектеспеді.Бір шақырғанда бірден ыдыстарды, бүлінген нәрселерді алып кетудің орнына, әр нәрсе үшін шақырып отырдық.Үнемі мынаны алып кетіңіз, мынаны әкеліңіз деп. Чизкейкты шоколадсыз әкелді, бірден шоколад қосайық па, шоколад, крошка бөлек ақша тұрады деп айтылмады. Мә деп қоя салды.",negative
151,Самый вкусный напалион просто супер 👍🏻,positive
152,"Классная кофейня, атмосфера супер. Хорошее обслуживание Асылбек топ✅😍",positive
153,"Асылбек крутой официант спасибо , было всё вкусно❤️",positive
154,"Хорошее место, внутри уютно и просторно
 Официант Дамир очень приятный молодой человек, пунктуальный и вежливый, быстро обслуживает
 Чай с облепихой очень вкусный, отдельное спасибо бариста
 Обязательно приду еще раз💞",positive
155,"Зашла сюда случайно, согреться. Очень красивое и уютное заведение, персонал отличный. Обслуживал официант Дамир, очень приятный и дружелюбный человек. Советую!✨",positive
156,"Была в этой кофейне. Десерты потрясающие, а обслуживание замечательное. Дарын был очень внимательным, спасибо ему за отличный сервис.
 П.с. Советую шоколадный круассан 😋😋",positive
157,Вкусные и сытные завтраки с оригинальной подачей. Приятный интерьер и внимательный персонал.,positive
158,"Очень уютное заведение и очень вкусная кухня. Много выбора десертов, приятная атмосфера, красивый дизайн интерьера. Вежливый персонал. Процветания вам! 🥰",positive
159,"очень уютная коыейня и вежливый официант💛 спасибо ему, что помог зарядить телефон",positive
160,Заведение супер! Сервис на высшем уровне! Завтраки классные!,positive
161,"Ух, отличное место! Взяли торт сникерс, медовик, кофе. Было очень вкусно! Спасибо! Так же спасибо за быстрое и вежливое обслуживание!",positive
162,уютное местооо,positive
163,"Керемет жер . Сіздерге наполеон тортын алуға кеңес беремін , өте тойымды , әрі дәмі үйде анамыз пісіретін наполеонға татиды . Даяшылар да сыпайы , ақкөңіл . Сервиске рақмет!",positive
164,Отличная кухня и очень внимательный персонал. Особая благодарность официанту Дарын .,positive
165,"Вчера заказывали наполеон: ну очень понравился!
 Безумно вкусный торт, выше всяких похвал!
 Не крем, а мороженое, не коржи, а легкие таящие во рту кусочки слоеного теста!
 Такого «наполеона» нигде не пробовали! Спасибо!",positive
166,Круассан с нутеллой…❤️,positive
167,"Давно хотела посетить данное заведение и вчера наконец удалось это сделать.
 Мне понравилась абсолютно всё! Интерьер, сервис, персонал, чистота, еда и выпечка всё на высшем уровне.
 Отдельное благодарность администратору за помощь 🤍",positive
168,"Очень красиво. Обслуживания, локация, сервис, кухня 10/10😍",positive
169,"Недавно посетила заведение, очень понравился интерьер, уютно 😍 вкусные завтраки и божественные десерты 🤤 Спасибо обслуживающему персоналу на оперативное обслуживание и вежливость 🫶🏻",positive
170,"Посетил заведение первый раз, сказали что недавно открылись, очень вкусные десерты и завтраки. Романтичное место 🙂 Спасибо Альбине",positive
171,"Отличное заведение, вежливый персонал. Особенной абалденные круассаны",positive
172,"Классное , уютное заведение с приятными ценами , возле речки . Приятный персонал , выпечка 🥐 супер",positive
173,"Очень вкусные торты, персонал вежливый, оперативно отвечают на запросы, заказывала торт на день рождение, на следующий день был уже готов)) советую всем, не пожалеете",positive
174,Наконец отличное заведение на территории коктема😎 вдоль весновки все больше классных заведений🔥,positive
175,Bal кофейнясының тамақтары да қызмет көрсетуі да ұнады.Дарынға рахмет!,positive
176,"Өте керемет кофейня 😍 официант Дарын өте сыпайы, бізге ұнады👍",positive
177,"Бәрі керемет, Дарын🔥🔥🔥",positive
178,"Бал, уютное местечко
 выпечки и затраки очень вкусные.
 Витриншицы Айман и Динара вежливые и улыбчивые, очень приятные!
 Основное меню что то с чем то, вкуснее нечего не ел)
 Советую попробовать круассаны и завтраки
 Спасибо вам🤍",positive
179,"тут все так вкусно, особенно завтраки!!😋Мне прям понравилось пирог с вишней,вообще топтоп,витринщица Айман крутая,все идеально и профессионально ☺️
 Спасибо вам🥰 приходите в BAL🤎 всем советую ☺️🫶🫶🫶🫶",positive
180,"Прекрасное местечко 🌞
 Вкусные блюда, особенно все сладости и выпечки на витрине (мне особенно понравилось клубничный и миндальный круассан)а из бара облепиховый чай🤗🤗🤗
 Девушка на витрине (Айман) вежливая и все понятно объясняет!
 Мне очень понравилось 🥰 спасибо 🤍🤍🤍",positive
181,"Очень вкусная кухня завтраки и обеды есть 👍🏻 Морталелла с яичницей 🔥Выпечка и торты нам все понравилось😍 Официанты молодцы 👏🏻 очень вежливые !
 Очень красивое эстетичное место и цены приемлимые. Очень довольна 🫶🏻",positive
182,вкусная выпечка 💓,positive
183,"Очень уютное местечко, а главное еда супер вкусная. Советую попробовать пасту с креветками. Официант Дарын очень вежливый, нам понравилось!!",positive
