,Review,
280,"Если вы заядлый сладкоежка как я , то рекомендую по пробовать «наполеон» , вот честное слово никогда я ещё не пробовал такой вкусный торт , хотя стаж более 15лет, это не реклама , а честный отзыв. Частенько буду сюда после прогулок залетать",positive
281,Атмосферное и уютное заведение 🫶🏼,positive
282,"Все отлично, интерьер, обслуживание и очень вкусно!",positive
283,"Приятный интерьер и обслуживание, неплохой кофе",positive
284,"Шикарно!!!!Вкусная еда,вежливые официанты, красивая музыка, ОЧЕНЬ КРАСИВЫЙ ИНТЕРЬЕР!!!!Я рада, что в коктеме появилась достойное кафе)",positive
285,"Ура, наконец-то появилось хорошее кафе на районе 🥳",positive
286,"Очень вкусные десерты и какао . Официант Дарын очень внимательный и приветливый. Нам очень понравилось всё:кухня , интерьер дизайн посуды и обслуживание на высоте.",positive
287,"Отличное заведение
 Персонал очень вежливый
 Все отлично 👍🏻💯",positive
288,"Очень эстетичное и красивое место, завтраки просто изумительные. Десерты вообще любовь💔",positive
289,Вкусноо и обслуживание топ!,positive
290,"Все очень вкусно, особенно круассаны с миндалем!",positive
291,"Зачем пишите что открыто, если там до сих пор идут ремонтные работы",negative
292,"Зачем писать работаем, если идет ремонт и вы закрыты?! Вводите людей в заблуждение рекламами, а заведение еще не функционирует даже!",negative
293,Заведение ещё закрыто!,negative