,Review,
1,"Беру тут Наполеон для разных праздников! Всегда все очень вкусное свежее, Наполеон и круассаны просто топ",positive
2,"Очень уютное место 😍
 Сотрудники 100/10 официант Турар 👍
 Десерты 10/10
 Чай Немножко не мой вкус а так все прекрасно 👍",positive
3,"Как человек любящий наполеон пришел сюда по рекламе в инсте.
 Ожидание - реальность не совпали. Наполеон жирноват и не прям самый вкусный как это заявляли в рекламе.
 Самое ужасное это - громкая музыка! Это разве клуб?
 

 Самый вкусный наполеон для меня был в Sandyq, но у них испортилось качество (стал сухим), об этом оставил отзыв у них на странице в 2 гис.
 

 Ну, а самый топовый наполеон в городе для меня это - не большая кондитерская MS Bakery (если кто помнит наполеон в ТРЦ Silk way city, то именно этот вкус теперь в данной кондитерской).",negative
4,"Очень вкусно , краусан шоколадный очень свежий тает во рту , и кофе прям вкусный 😍а я тот еще знаток в кофейнях 😎
 Однозначно советую, главное не растеряйте свою особенность 🤗",positive
5,"Приходила 2 раза, и как же тут вкусно! Коз тимесин😄
 + я заказывала пасту с лососем и вялеными помидорами, это такое удачное сочетание! Очень интересный вкус помидорок, салат греческий тоже был сочным и вкусным, ну, и конечно же, их фирменный Наполеон. Он шикарен.
 

 +отзывчивый персонал и админ
 

 + красивый сервиз Тюдор прекрасно вписывается в стилистику
 ————
 – сервиз красивый, но именно чайные пары моют не качественно, а именно где ручка чашки. Из-за текстурного покрытия в щелях между рисунком остается чай, это конечно не совсем приятно. Нам подали 2 пары и в обеих были не промытые места. Учтите пожалуйста это.
 

 Я надеюсь, что Бал сохранит свое качество блюд и обслуживания! Пусть ваше дело процветает🫶🏻🩷",positive
6,"Всё супер прям 🤭 наполеон бомбезный, чай тоже и официанты тоже классно справляются с работой желаю удачи 🤍",positive
7,Вкусно и уютно,positive
8,"Приятная и уютная атмосфера в зале, отличное обслуживание, очень вкусный кофе и не менее вкусная кухня☺️💖
 Ещё увидела отзыв про наполеон, хочу дополнить, что это правда, что он там безумно вкусный, такого нежного и вкусного пока нигде не пробовала🥹",positive
9,"официанту Асылбек огромное спасибо за гостеприимство и работу,отличное заведение 👍🏻",positive
10,Уютно и вкусно!,positive
11,"Вообще вкусно и уютно.
 Утром в булочной очень медленно ею и невнимательное обслуживание, что очень жаль.",positive
12,Безумно вкусный наполеон 🤭🤤,positive
13,"Уютно, чисто. Неплохая кухня. Пришли из-за наполеона, но и покушали сразу.
 Говяжьи щечки вкусные, бургер не впечатлил к сожалению. Наполеон вкусный, кофе обычный. Салат с баклажанами вкусный, но не вау",positive
14,"Замечательное заведение с уютной атмосферой😍официант по имени Муханбет очень хорошо обслужил, спасибо ему🥰🥰🥰",positive
15,"Отличное заведение! 😍 Очень вкусно и атмосферно. Вежливый персонал, хорошее обслуживание, в особенности официант Альбина! С удовольствием зайду в заведение еще раз!",positive
16,"Приятная атмосфера, вежливый персонал. Обязательно загляну снова! Особая благодарность Альбине😍😍",positive
17,"Любимое заведение🫶🏻
 Сотрудники очень приветливые✨️
 Особенно девушка по имени Альбина🫂
 Очень уютно и комфортно здесь. Советую посетить🤍",positive
18,"Одно из любимых заведений города😋 Еда, атмосфера и обслуживание на высшем уровне😍 Отдельное спасибо Альбине, очень вежливая и приятная девушка) Обязательно вернемся еще)))",positive
19,"Альбина – отличный официант! Вежливая, внимательная и быстрая. Учла все пожелания, обслуживание было на высшем уровне. Спасибо за приятную атмосферу🫶🏻",positive
20,"Турар очень приятный официант! Все вовремя приносит, на все просьбы реагирует оперативно, обслуживает обалденно!",positive
21,"Турар топ топ топ падам падам 🔥
 Паста 🔥😍",positive
22,Тұрар топ топ топ😮,positive
23,вкусно и красиво😻,positive
24,"Тик токтан көріп келгенмін.Напалеон үшін келдім,десерттері бәрі өте күшті дәмді.Маған ұнады.И бізге обслужка жасаған Альбина дитін оффициант қыз.өте керемет қызмет көрсетті,пысық,өз ісінің маманы бізге бәрі ұнады👍",positive
25,"Все понравилось, официант Альбина - профессионал, приятная, милая девушка, Наполеон очень вкусный, рекомендую",positive
26,"Алматыдағы ең күшті наполеон! Жалпы өзің немесе отбасымен десерт жеп, отыру керемет жер. Бағалары жақсы. Тұрар кісі өте мейірімді, обслуживание жоғарыда!",positive
27,"Всё понравилось:блинчики, курица с овощами… Турар - лучший официант!!!",positive
28,"Зашёл. Бариста на стойке предложил присесть, официанты проигнорировали. Посадка 1/3 может меньше.Занял столик. Ждал... Нажал кнопку... Полный игнор))
 Официанты видели меня.
 Так и не получил обслуживания 🤷🏼",negative
29,"Бариста не знает свою работу
 Вежливость просто 0
 Наглый в общении с людьми, не признает своих ошибок. Остальной персонал очень хороший, все вкусно",negative
30,Вкусный наполеон 😍😍😍,positive
31,"Мне понравилось, вежливые и внимательные официанты, сначала заехал по совету взял здесь Наполеон, по словам самый лучший в городе. Ну не прям лучший, но необычный и точно стоит попробовать. Заехали на завтрак с переходом в обед, я заказал пасту с сёмгой, все отлично, не хватило только отдельно бальзамика и перца который можно молоть, жена позавтракала, ей тоже вкусно. Ребятам успехов!",positive
32,"Вчера заказала спагетти с морепродуктами, было невкусно. Подача симпатичная, но не стоит судить по обложке. Еда была холодная, будто морепродукты заранее были отварены и положили для украшения. Спагетти как будто чересчур «аль-дэнтэ», если не ошибаюсь, там был пармезан, сыр даже немного не расплавился, потому что, как я написала выше блюдо было холодное. Не стала конфликтовать, съела, оплатила и ушла. Некоторых десертов в наличии не было, тоже расстроило🥹",negative
33,"Приятное место. Очень вкусная выпечка, особенно торт наполнен! Хорошее место чтобы выпить кофе и пообщаться с друзьями!",positive
34,"Большое спасибо за прекрасное обслуживание!
 Кофе превосходный, десерты свежие, а атмосфера располагает к отдыху. Обязательно вернусь снова!
 Обслуживание отличное спасибо Турару.",positive
35,"«Очень уютная кофейня с дружелюбным персоналом, который заботится о каждом госте. Спасибо Турару. Особенно понравились свежие десерты 😍”",positive
36,"Классное место,красивый,уютный.Насчет кухни всё вкусноо всегда,и круассаны,наполеоны прям тает во рту.Обслживание на высшем уровне!",positive
37,"Өте дәмді😍🥹тәттілері
 Іші, уют, комфорт😚👒",positive
38,Обслуживание топчик👍🏻,positive
39,"Тағамдары өте дәмді, тез дайындалады, қызмет көрсету сапасы өте жоғары деңгейде👍🔥 Бәрі ұнады, рақмет!",positive
40,Это был самый вкусный наполеон в моей жизни! И сервис классный!,positive
41,"Мне очень нравится эта кофейня.
 Вкусные десерты, уютный интерьер, всё, что там есть, можно сказать продумано до мельчайшей детали.
 Хочу также отметить вежливый и заботливый персонал. Спасибо большое Администратору Камиле, что старалась урегулировать возникший конфликт между мной и другим посетителем профессионально и деликатно.
 Кратко: другой посетитель на полную громкость смотрел свои видео, перелистывая шортсы на телефоне, что мне, как посетителю мешало провести время расслабленно и в приятной обстановке за завтраком. Я вежливо попросила его надеть наушники или убавить звук на телефоне. На первую просьбу он сказал ок, но при этом продолжал в том же духе. На вторую мою просьбу он отреагировал агрессивно и сказал: ""Если тебе не нравится, то вали в другое место"". Он привёл достаточно странный аргумент, сказав, что это общественное место и что он хочет, то и будет делать. Перешел на личные оскорбления, и на просьбы Администратора заведения учитывать интересы других посетителей кофейни он демонстративно встал и начал пугать ее тем, что будет жаловаться Руководству заведения. Поэтому хочу сказать Руководству BAL: потеряв клиента в лице данного мужчины, вы приобретете других - более культурных и платежеспособных клиентов.",positive
42,"Покупаю в этой кофейне уже не первый раз, и всегда остаюсь довольна качеством выпечки. Особенно хорош песочный вишнёвый пирог – идеальный баланс сладости и кислинки. Персонал вежливый и внимательный, помогают по вопросам. Было бы удобно, если бы добавили услугу доставки.",positive
43,10/10 супер!!!,positive
44,"Апельсиновый капучино это самое ужасное что я пробовала в жизни 🤢🤮 , уберите это из меню и не травите людей",negative
45,Отзывтарды карасам Турар деген офка мен гана емес барлыгы ырза екен. Бари унады тамактары оте оте дамди Турарга болек респект👍,positive
46,"Отличное место ☺️
 Уютно,атмосферно и очень вкусно ❤️
 Десерты отдельный вид искусства 😍",positive
47,Все классно!,positive
48,"Бәрі дәмді болды! Турар офицант жақсы қызмет көрсетті, интерьер өте әдемі.",positive
49,"тагамдары оте дамди, кызмет корсету жогары денгейде, Турар бизге оте жаксы кызмет корсетти, ракмет!",positive
50,"Тамақтары тәтті, қызмет көрсету сапасы жоғары деңгейде (Турар)",positive
51,"Вкусно, уютно",positive
52,"Қызмет көрсетуі, десерттері ТОП! Әсіресе Тұрар есімді даяшы риза болдық! Өте сыпайы, кез келген өтінішті орындап, жұмысын 100% орындады! Рақымет!",positive
53,"Очень комфортная и уютная атмосфера, приветливый персонал, вкусная еда. Отдельное спасибо девушке Аяулым 💐",positive
54,"Милый персонал, вкусные завтраки",positive
55,"Беру тут Наполеон для разных праздников! Всегда все очень вкусное свежее, Наполеон и круассаны просто топ",positive
56,"Очень уютное место 😍
 Сотрудники 100/10 официант Турар 👍
 Десерты 10/10
 Чай Немножко не мой вкус а так все прекрасно 👍",positive
57,Бари Керемет 😍👍,positive
58,"Керемет жер екен. Тамаша қызмет, бәрі дәмді",positive
59,Классная атмосфера😍Еда очень вкусная 🫶🏻Вежливый персонал🥰,positive
60,Так вкусно накормили в кафе Bal и милый наш официант Мухаммед внимательный и отзывчивый 🥹🥹🥹Благодарю вас 😇,positive
61,"Всегда осы жерден тамақтанамыз тамақтары өте дәмді және свежий 😍😍,дизайны барлығы өте қатты ұнайды
 Официант Дарынға рахмет",positive
62,👍👍👍👍маған ұнады барлық жер осылай қызымет көрсетсе👍,positive
63,Өте дамді тамактары! Іші өте керемет екен офицантарыда адемі жумыс стеиді екен келесі жолы келуге түралық екен!,positive
64,"Очень хорошее место, мне нравится. Хочу поблагодарить Дастана, который принял мой заказ и быстро его принес. Он очень сильный официант ✊🏻.",positive
65,Кушти мейрамхана асиресе кызмет корсетулери Дастан Деген жигит керемет,positive
66,Очень классное заведения мне очень понравился особенно обслуживания на высшем уровне особенно хочу отметить Дастана по моему так звали его респект,positive
67,"Вчера столкнулся с крайне неприятной ситуацией. Сделал заказ, и мне пообещали, что через час торт будет у них, и его сразу доставят. Через 2.5 часа, заказа так и не было. Я несколько раз пытался связаться с ними, чтобы уточнить, в чём дело, но никакой конкретной информации получить не удалось.
 

 Если вы не можете выполнить заказ в обещанные сроки, зачем вообще давать такие обещания? Это не только вводит в заблуждение клиентов, но и создаёт крайне негативное впечатление о сервисе.
 Такое ощущение, что сотрудники сами не заинтересованы в качестве работы, а страдает от этого бизнес и его репутация. Очень жаль владельца, ведь из-за таких ситуаций теряются клиенты и доверие к компании.
 

 Крайне разочарован и не рекомендую обращаться, если важна оперативность и профессионализм.
 

 P.s по доставке был первый опыт, а место было знакомо.
 -1 клиент, но для них это ерунда.
 После 100 человек точно задумаются.
 Хотя есть такие индивиды, которые думают одним меньше больше, какая разница, в городе же кроме них никто торты за 8 тысяч не продает.
 Зачем им переживать. 😂",negative
68,"Вкусный наполеон! Обслуживание хорошее! Я отмечала день рожденья там, но почему-то скидку не сделали хотя говорили что обязательно полагается.",positive
69,Өте дәмді. Бізге ұнады😍,positive
70,"Заказали доставку на дом. Круассаны и наполеон идеальные, понравились. Но Мадлен твердый сухой, брать не советую. Написала им, в ответ получила - Мы приносим извинения и передам это кондитером, спасибо за обратную связь - come on ребята вы отправили не соответствующее пирожное???!!! Испорченные впечатления еще из за того, что все что я заказала положили в тесную коробку, все пришло друг на друге 😂",negative
71,"Блин обрадовалась что рядом с домом наконец есть кофейня, и какого было мое разочарование ужасно не вкусная кухня! Такое уютное место поменяйте повара, завтраки такие фу",negative
72,"өтеее керемеет орын, барлығыңызға советую🤙🏻 Клиенттерге қызмет көрсетуі жоғарыы деңгейде, Особенно Тұрар және Асылбек деген официанттар өте сүйкімді. Жоғары деңгей🌟",positive
73,"Завтраки вкусные, сытные. 10/10😍
 Десерты немного ожидание/реальность. Круассан был не свежим, 6/10. Тары чизкейк жирноватый, не было того самого вкуса сырного, творожного вкуса 5/10. Напитки и кофе хорошие.👍🏻 За все это у нас вышло 13 тысяч",positive
74,"Дастан мен Тұрар деген жігіттерге мың алғыс,тамақтарымызды уақытылы алып келіп берді.Көп рахмет ,жарайсыңдар жігіттер",positive
75,Тұрар топ топ🚀🚀🚀🚀,positive
76,"Тұрар деген балаға рахмет, жақсы қызмет көрсетті👍",positive
77,"Двойка за сервис, пришел заказать с собой. Два чая и выпечка. Все приготовили, но позвать и сказать, что готово не могли. Подставку и пакет пришлось просить, но даже после всего этого пришлось упаковать все самому, в куртке не удобно делать. Поработайте с персоналом.",negative
78,"Очень вкусные десерты и атмосферная кофейня, балгодарим за комплимент от кофейни и за хороший сервис!",positive
79,"Супер!
 Очень вкусно!
 Заказали спагетти с креветками и соусом из шпината, обалденно вкусно
 Салат с индейкой и запеченной тыквой не менее вкусный
 Сегодня был праздник живота
 Дополнили десертом ( Наполеон ) с чашечкой Латте
 Спасибо Вам за всё!",positive
80,"Очень стильно и уютно, персонал вежливый",positive
81,Рекламируют торт наполеон приезжаешь через весь город а его нет. Короче как всегда…,negative
82,"Атмосфера, уют , интерьер, обслуживание, вкус все на высшем уровне 💯💯💯",positive
83,"Атмосфера, интерьер красивый
 Еда и десерты очень вкусные
 Имеется даретхана и намазхана",positive
84,"Очень приятное место!
 Вкусные завтраки и кофе. Очень вежливые хостес и чуткие официанты (нас обслуживал Асылбек)",positive
85,"Сегодня посетили эту кофейню — очень красивое и уютное место. Все было невероятно вкусно, благодарим персонал за отличный сервис!Нам все понравилось 🙌🏻✨✨",positive
86,пити из пити✨,positive
87,Обслуживание топ топ!,positive
88,Десерттері дәмді,positive
89,"Все очень вкусно, оффицианты вежливые все на высшем уровне🫶🏻🫶🏻",positive
90,"Все прекрасно, понравилось",positive
91,Всё вкусно,positive
